{
  "$schema": "https://json-schema.org/draft/2020-12/schema",
  "$id": "https://jocky.dev/schemas/v1/build-manifest.schema.json",
  "title": "BuildManifest",
  "description": "Compiler-to-runtime package metadata contract. Version 0 does not produce packages.",
  "type": "object",
  "additionalProperties": false,
  "required": [
    "schema_version",
    "build_id",
    "package_id",
    "built_at",
    "language_version",
    "ir_version",
    "compiler_version",
    "package_format",
    "target",
    "build_profile",
    "entrypoint",
    "required_capabilities",
    "required_privilege",
    "source_sha256",
    "artifact_sha256",
    "native_dependencies",
    "transformations"
  ],
  "properties": {
    "schema_version": {
      "const": "1.0.0"
    },
    "build_id": {
      "type": "string",
      "format": "uuid",
      "pattern": "^[0-9a-fA-F]{8}-[0-9a-fA-F]{4}-[0-9a-fA-F]{4}-[0-9a-fA-F]{4}-[0-9a-fA-F]{12}$"
    },
    "package_id": {
      "type": "string",
      "format": "uuid",
      "pattern": "^[0-9a-fA-F]{8}-[0-9a-fA-F]{4}-[0-9a-fA-F]{4}-[0-9a-fA-F]{4}-[0-9a-fA-F]{12}$"
    },
    "built_at": {
      "type": "string",
      "format": "date-time",
      "pattern": "^\\d{4}-\\d{2}-\\d{2}T\\d{2}:\\d{2}:\\d{2}(?:\\.\\d+)?Z$"
    },
    "language_version": {
      "type": "string",
      "minLength": 1,
      "maxLength": 64
    },
    "ir_version": {
      "type": "string",
      "minLength": 1,
      "maxLength": 64
    },
    "compiler_version": {
      "type": "string",
      "minLength": 1,
      "maxLength": 64
    },
    "package_format": {
      "const": "jocky-package-v1"
    },
    "target": {
      "type": "object",
      "additionalProperties": false,
      "required": ["platform", "architecture"],
      "properties": {
        "platform": {
          "type": "string",
          "enum": ["windows", "ubuntu"]
        },
        "architecture": {
          "type": "string",
          "enum": ["x86_64", "aarch64"]
        }
      }
    },
    "build_profile": {
      "type": "string",
      "enum": ["development", "release", "lab_only"]
    },
    "entrypoint": {
      "type": "string",
      "pattern": "^[A-Za-z_][A-Za-z0-9_.]*$",
      "maxLength": 255
    },
    "required_capabilities": {
      "type": "array",
      "uniqueItems": true,
      "items": {
        "type": "string",
        "enum": [
          "system",
          "processes",
          "network",
          "files",
          "events",
          "persistence",
          "drivers",
          "indicators"
        ]
      }
    },
    "required_privilege": {
      "type": "string",
      "enum": ["user", "elevated", "lab_only"]
    },
    "source_sha256": {
      "type": "string",
      "pattern": "^[a-f0-9]{64}$"
    },
    "artifact_sha256": {
      "type": "string",
      "pattern": "^[a-f0-9]{64}$"
    },
    "native_dependencies": {
      "type": "array",
      "uniqueItems": true,
      "items": {
        "type": "string",
        "minLength": 1,
        "maxLength": 255
      }
    },
    "transformations": {
      "type": "array",
      "items": {
        "type": "object",
        "additionalProperties": false,
        "required": ["name", "version", "configuration_sha256"],
        "properties": {
          "name": {
            "type": "string",
            "minLength": 1,
            "maxLength": 128
          },
          "version": {
            "type": "string",
            "minLength": 1,
            "maxLength": 64
          },
          "configuration_sha256": {
            "type": "string",
            "pattern": "^[a-f0-9]{64}$"
          }
        }
      }
    }
  }
}

